{
  "manifest_version": 1,
  "name": "motion-carousel",
  "version": "1.0.0",
  "type": "skill",
  "trail": "divulgar",
  "title": {
    "pt-BR": "Carrossel animado",
    "en": "Motion carousel"
  },
  "summary": {
    "pt-BR": "Cria carrosséis para o Instagram em que cada slide é um vídeo curto em loop, com movimento e som na batida, a partir de um tema; entrega os MP4 prontos para postar e uma prévia de como fica no feed.",
    "en": "Creates Instagram carousels where each slide is a short looping video with motion and sound on the beat, from a topic; delivers the MP4s ready to post and a preview of how it looks in the feed."
  },
  "compatible_ais": [
    "claude_code"
  ],
  "min_core": ">=1.1.0",
  "entry": "skills/motion-carousel/SKILL.md",
  "files": [
    "README.md",
    "guides/en/usar.md",
    "guides/pt-BR/usar.md",
    "references/design-rules.md",
    "references/exemplo/brief.md",
    "references/exemplo/slides/01.html",
    "references/exemplo/slides/02.html",
    "references/exemplo/slides/03.html",
    "references/exemplo/slides/04.html",
    "references/exemplo/slides/05.html",
    "references/exemplo/storyboard.json",
    "references/slide-page.md",
    "references/sound.md",
    "references/storyboard.md",
    "runtime/carousel.js",
    "runtime/preview.html",
    "runtime/slides/cta.html",
    "runtime/slides/hook.html",
    "runtime/slides/point.html",
    "scripts/carousel.mjs",
    "scripts/lib/engine.mjs",
    "scripts/lib/preview.mjs",
    "scripts/lib/project.mjs",
    "scripts/lib/storyboard.mjs",
    "scripts/lib/util.mjs",
    "skills/motion-carousel/SKILL.md"
  ],
  "external_credentials": [],
  "permissions": [
    {
      "kind": "shell",
      "scope": "node .flyee/modules/motion-carousel/scripts/carousel.mjs",
      "reason": {
        "pt-BR": "O script do app cria a pasta do carrossel, escreve o roteiro e os slides a partir dos modelos, chama o Motor de vídeo slide a slide, monta a prévia, abre-a no seu navegador e grava o relatório da conferência.",
        "en": "The app's script creates the carousel folder, writes the storyboard and the slides from the templates, calls the Video engine slide by slide, builds the preview, opens it in your browser and writes the check report."
      }
    },
    {
      "kind": "shell",
      "scope": "node .flyee/modules/video-render/scripts/render.mjs",
      "reason": {
        "pt-BR": "O Motor de vídeo fotografa os quadros, renderiza cada slide, sintetiza a trilha e os efeitos, mede as batidas da sua música, mixa o som no volume das redes e confere cada slide.",
        "en": "The Video engine photographs the frames, renders each slide, synthesizes the music and the effects, measures the beats of your own track, mixes the sound at the networks' loudness and checks each slide."
      }
    },
    {
      "kind": "shell",
      "scope": "ffmpeg, ffprobe",
      "reason": {
        "pt-BR": "Codifica os quadros de cada slide em vídeo, mixa o áudio, mede o volume e monta as folhas de quadros. A sua IA instala o ffmpeg na primeira vez que o app precisar, depois de avisar.",
        "en": "Encodes each slide's frames into video, mixes the audio, measures loudness and builds the frame sheets. Your AI installs ffmpeg the first time the app needs it, after telling you."
      }
    },
    {
      "kind": "shell",
      "scope": "o navegador já instalado (Microsoft Edge, Google Chrome ou Chromium), aberto sem janela para fotografar a página",
      "reason": {
        "pt-BR": "Fotografa cada quadro de cada slide sem abrir janela. No Windows o Microsoft Edge já vem instalado; no Mac e no Linux a sua IA instala o Chromium se faltar.",
        "en": "Photographs every frame of every slide without opening a window. Microsoft Edge comes with Windows; on Mac and Linux your AI installs Chromium when none exists."
      }
    },
    {
      "kind": "fs:read",
      "scope": "a pasta de cada carrossel (./carrosseis/<nome>/), com o logo, as imagens e a música que você deixar em assets/",
      "reason": {
        "pt-BR": "Lê o roteiro e as páginas dos slides, o logo e as imagens que os slides desenham e a música que você escolher. Os arquivos que você trouxer nunca são alterados.",
        "en": "Reads the storyboard and the slide pages, the logo and images the slides draw and the track you choose. The files you bring are never changed."
      }
    },
    {
      "kind": "fs:write",
      "scope": "./carrosseis/ e a pasta temporária do sistema",
      "reason": {
        "pt-BR": "Grava, uma pasta por carrossel, o briefing, o roteiro, os slides, a trilha, os efeitos, as prévias, os vídeos finais, a página da prévia e o relatório; arquivos de passagem ficam na pasta temporária e são apagados ao final.",
        "en": "Writes, one folder per carousel, the brief, the storyboard, the slides, the music, the effects, the previews, the final videos, the preview page and the report; scratch files stay in the temporary folder and are deleted at the end."
      }
    }
  ],
  "changelog": {
    "pt-BR": "Primeira versão: carrosséis de 2 a 20 slides em vídeo 4:5 (1080×1350) ou 3:4, em loop, com movimento e som na batida; briefing e roteiro (storyboard.json); modelos de slide por papel (gancho, ponto, chamada final) e um exemplo completo de cinco slides; cinco temas visuais e cinco estilos de trilha gerada no seu computador, ou a sua própria música; prévia que imita o celular, com grade de continuidade e botão de som; conferência de cada slide (capa legível, zona segura do Instagram, texto mínimo, emenda do loop e, no vídeo final, piscadas, tempo parado e volume) e do conjunto; refazer um slide sem refazer os outros. Só tipografia, formas e cor nesta versão.",
    "en": "First version: carousels of 2 to 20 slides as 4:5 (1080×1350) or 3:4 looping videos, with motion and sound on the beat; brief and storyboard (storyboard.json); slide templates per role (hook, point, call to action) and a complete five-slide example; five visual themes and five styles of music generated on your computer, or your own track; a phone-like preview with a continuity grid and a sound button; checks per slide (readable cover, Instagram safe area, minimum text size, loop seam and, on the final video, flashes, still time and loudness) and for the set; redo one slide without redoing the others. Typography, shapes and colour only in this version."
  },
  "license": "member"
}
