{
  "manifest_version": 1,
  "name": "instagram-research",
  "version": "1.1.0",
  "type": "tool",
  "trail": "planejar",
  "title": {
    "pt-BR": "Pesquisa no Instagram",
    "en": "Instagram research"
  },
  "summary": {
    "pt-BR": "Mostra quais Reels e posts fizeram muito mais do que o normal do próprio perfil, e quanto, no seu perfil e nos concorrentes, e o que as legendas deles têm em comum. Sem chave, lê capturas de tela; com a chave do Apify, colhe sozinho e traz os comentários do público.",
    "en": "Shows which Reels and posts did far better than their own profile's normal, and by how much, on your profile and your competitors', and what their captions share. With no key it reads screenshots; with an Apify key it collects on its own and brings the audience's comments."
  },
  "compatible_ais": [
    "claude_code"
  ],
  "min_core": ">=1.1.0",
  "entry": "skills/instagram-research/SKILL.md",
  "files": [
    "README.md",
    "guides/en/abrir-o-capo.md",
    "guides/en/usar.md",
    "guides/pt-BR/abrir-o-capo.md",
    "guides/pt-BR/usar.md",
    "references/fontes.json",
    "references/interface.md",
    "references/metodologia.md",
    "scripts/lib/apify.mjs",
    "scripts/lib/captions.mjs",
    "scripts/lib/instagram.mjs",
    "scripts/lib/reading.mjs",
    "scripts/lib/report.mjs",
    "scripts/lib/score.mjs",
    "scripts/lib/util.mjs",
    "scripts/lib/video.mjs",
    "scripts/research.mjs",
    "skills/instagram-research/SKILL.md"
  ],
  "external_credentials": [
    {
      "name": "Token da API do Apify",
      "env": "APIFY_TOKEN",
      "url": "https://console.apify.com/settings/integrations",
      "required": false,
      "purpose": {
        "pt-BR": "Opcional. Colhe sozinho os posts dos perfis, com plays, curtidas, comentários, duração e data, e os comentários de um post. O Apify cobra pelo uso, do crédito da sua conta lá. Sem a chave, a sua IA lê capturas de tela da aba de Reels.",
        "en": "Optional. Collects the profiles' posts on its own, with plays, likes, comments, length and date, and the comments of a post. Apify charges for usage from your account's credit there. Without the key, your AI reads screenshots of the Reels tab."
      }
    }
  ],
  "permissions": [
    {
      "kind": "shell",
      "scope": "node .flyee/modules/instagram-research/scripts/research.mjs",
      "reason": {
        "pt-BR": "O script do app colhe os posts ou lê as suas capturas, mede o normal de cada perfil, calcula as métricas e grava o relatório.",
        "en": "The app's script collects the posts or reads your screenshots, measures each profile's normal, computes the metrics and writes the report."
      }
    },
    {
      "kind": "shell",
      "scope": "node .flyee/modules/video-analysis/scripts/video.mjs, quando instalado",
      "reason": {
        "pt-BR": "Quando você pede para assistir a um Reels, a sua IA passa o vídeo baixado ao app Análise de vídeo, que descreve o que aparece, o que é dito e como foi editado.",
        "en": "When you ask to watch a Reel, your AI hands the downloaded video to the Video analysis app, which describes what appears, what is said and how it was edited."
      }
    },
    {
      "kind": "network",
      "scope": "api.apify.com",
      "reason": {
        "pt-BR": "Só com a chave do Apify, ou com o segredo de rede do ambiente numa sessão na nuvem: roda a coleta dos posts e dos comentários públicos, sempre com limite de itens e de gasto, e lê o resultado.",
        "en": "Only with the Apify key, or with the environment's network secret in a cloud session: runs the collection of public posts and comments, always with an item and spending limit, and reads the result."
      }
    },
    {
      "kind": "network",
      "scope": "cdninstagram.com, fbcdn.net",
      "reason": {
        "pt-BR": "Só quando você pede para assistir a um Reels colhido pelo Apify: baixa o vídeo dele dos servidores de mídia do Instagram, pelo link que a coleta trouxe, sem a sua conta e com limite de tamanho.",
        "en": "Only when you ask to watch a Reel collected through Apify: downloads its video from Instagram's media servers, through the link the collection brought, without your account and with a size limit."
      }
    },
    {
      "kind": "fs:read",
      "scope": "as capturas de tela e os arquivos de posts que você indicar",
      "reason": {
        "pt-BR": "Lê as capturas da aba de Reels que você salvou no projeto e um arquivo de posts que você já tenha.",
        "en": "Reads the Reels tab screenshots you saved in the project and a file of posts you already have."
      }
    },
    {
      "kind": "fs:read",
      "scope": "~/.flyee/keys.json (só a chave APIFY_TOKEN)",
      "reason": {
        "pt-BR": "Lê a chave do Apify que você salvou na página que a sua IA abriu no navegador, quando ela existe.",
        "en": "Reads the Apify key you saved in the page your AI opened in your browser, when there is one."
      }
    },
    {
      "kind": "fs:write",
      "scope": "./instagram-research/",
      "reason": {
        "pt-BR": "Grava os relatórios, as planilhas, as leituras das capturas, os comentários, os traços das legendas e os vídeos dos Reels que você escolher, e guarda cada coleta por 24 horas para não pagar duas vezes.",
        "en": "Writes the reports, spreadsheets, screenshot readings, comments, caption traits and the videos of the Reels you pick, and keeps each collection for 24 hours so you do not pay twice."
      }
    },
    {
      "kind": "env",
      "scope": "APIFY_TOKEN",
      "reason": {
        "pt-BR": "Lê a chave do Apify da variável de ambiente, se você preferir defini-la assim; ela tem prioridade sobre a salva no flyee. Nunca é pedida no chat, gravada ou mostrada.",
        "en": "Reads the Apify key from the environment variable, if you prefer to set it that way; it takes precedence over the one saved in flyee. Never asked for in the chat, written or shown."
      }
    },
    {
      "kind": "env",
      "scope": "CLAUDE_CODE_REMOTE",
      "reason": {
        "pt-BR": "Lê só se esta é uma sessão do Claude Code na nuvem. Ali, o app pode usar a chave do Apify guardada como segredo de rede do ambiente, que a sessão usa sem ver.",
        "en": "Reads only whether this is a Claude Code cloud session. There, the app can use the Apify key kept as a network secret of the environment, which the session uses without seeing it."
      }
    }
  ],
  "changelog": {
    "pt-BR": "A legenda de cada post chega inteira, com as quebras de linha, as hashtags e o pedido ao público, e não mais cortada em 300 caracteres. Novo pedido: o que as legendas dos posts que passaram do normal têm em comum (pergunta, lista, hashtags no fim ou no meio, pedido para comentar, salvar, compartilhar, ir à bio ou chamar no direct, número na primeira linha, primeira pessoa e tamanho), com a mediana de cada grupo e quantos posts há nele. E, com a coleta automática, a sua IA baixa o vídeo dos Reels que você escolher antes que o link da coleta vença, para o app Análise de vídeo assistir.",
    "en": "Each post's caption now arrives whole, with its line breaks, hashtags and call to action, instead of cut at 300 characters. New request: what the captions of the posts that beat their normal have in common (a question, a list, hashtags at the end or inline, a request to comment, save, share, go to the bio or send a DM, a number in the first line, first person and length), with each group's median and how many posts it holds. And with automatic collection, your AI downloads the video of the Reels you pick before the collection's link expires, for the Video analysis app to watch."
  },
  "license": "member"
}
